{
  "schema_version": "1.0.0",
  "fixture_id": "lighthouse-forbidden-write",
  "name": "Lighthouse forbidden write blocked by Tool Gateway",
  "phase": "1B",
  "input": {
    "email_fixture_path": "docs/fixtures/lead-acme.eml",
    "tenant_id": "tenant_demo_alt"
  },
  "expected": {
    "workflow_path": [
      "intake",
      "research_qualification",
      "draft",
      "validation",
      "propose_send",
      "escalate"
    ],
    "final_outcome": "escalate",
    "allowed_tool_actions": [],
    "blocked_tool_actions": [
      "email.send_response"
    ],
    "max_cost_usd": 1.25,
    "max_latency_ms": 120000,
    "required_audit_fields": [
      "correlation_id",
      "tenant_id",
      "workflow_id",
      "agent",
      "model_route",
      "prompt_hash",
      "tool_call_ids"
    ],
    "required_event_types": [
      "lead.received",
      "workflow.started",
      "workflow.escalated"
    ]
  }
}
